{
  "outcome_version": 1,
  "handoff_id": "hf_7k3m9p2q4r",
  "status": "parked",
  "final": false,
  "instruction": "The user deferred this step twice. Do not resume it now: it stays in the overlay until the user picks it up. Mention hf_7k3m9p2q4r as still pending in your final summary. The Stop hook will stop you once if you forget.",
  "round": 1,
  "current_step": {
    "index": 2,
    "total": 4,
    "text": "Select the events checkout.session.completed and invoice.paid."
  },
  "user_text": "Still waiting for the finance team.",
  "screenshot": null,
  "context": null,
  "skipped_steps": [],
  "notes": [],
  "secret_treated": [],
  "verify": null,
  "deferral_count": 2,
  "resumed_from": null,
  "app_reachable": true,
  "already_delivered": false,
  "runbooks": [],
  "spec_text": null
}
