{
  "outcome_version": 1,
  "handoff_id": null,
  "status": "text_mode",
  "final": false,
  "instruction": "The overlay app is not running. Present the spec below to the user in chat, walk them through the steps, and collect the result in chat. No log or verified state exists in this mode.",
  "round": 1,
  "current_step": null,
  "user_text": null,
  "screenshot": null,
  "context": null,
  "skipped_steps": [],
  "notes": [],
  "secret_treated": [],
  "verify": null,
  "deferral_count": 0,
  "resumed_from": null,
  "app_reachable": false,
  "already_delivered": false,
  "runbooks": [],
  "spec_text": "Handoff: Register the Stripe webhook for payment events\nWhere: Stripe Dashboard → Developers → Webhooks\nOpen: https://dashboard.stripe.com/webhooks\nWhy you: Requires access to the production Stripe account.\n\nValues:\n  endpoint_url = https://api.myapp.example/webhooks/stripe\n  events = checkout.session.completed, invoice.paid\n\nSteps:\n  1. Click Add endpoint and paste the endpoint URL. [endpoint_url]\n  2. Select the events checkout.session.completed and invoice.paid. [events]\n  3. Save and copy the signing secret.\n  4. Paste it into .env as STRIPE_WEBHOOK_SECRET.\n\nSecrets to copy into the project, never into the chat:\n  STRIPE_WEBHOOK_SECRET → .env"
}
