{
  "outcome_version": 1,
  "handoff_id": "hf_7k3m9p2q4r",
  "status": "abandoned",
  "final": true,
  "instruction": "The user abandoned handoff hf_7k3m9p2q4r. Do not retry the same steps and do not open a new handoff for the same goal: ask the user how they want to proceed.",
  "round": 1,
  "current_step": {
    "index": 2,
    "total": 4,
    "text": "Select the events checkout.session.completed and invoice.paid."
  },
  "user_text": "This account has no permission for webhooks; we will use the other project.",
  "screenshot": null,
  "context": null,
  "skipped_steps": [],
  "notes": [],
  "secret_treated": [],
  "verify": null,
  "deferral_count": 0,
  "resumed_from": null,
  "app_reachable": true,
  "already_delivered": false,
  "runbooks": [],
  "spec_text": null
}
