{
  "outcome_version": 1,
  "handoff_id": "hf_7k3m9p2q4r",
  "status": "awaiting_verification",
  "final": false,
  "instruction": "The user finished the steps and the spec asked for a verification. Perform it yourself with your own tools, then report it: call handoff_verify with handoff_id hf_7k3m9p2q4r, verify.ok set to true, false or null, and a verify.detail saying exactly what you ran and what you observed. Never read the values listed in secrets: check their presence or their effect only.",
  "round": 1,
  "current_step": {
    "index": 4,
    "total": 4,
    "text": "Paste it into .env as STRIPE_WEBHOOK_SECRET."
  },
  "user_text": null,
  "screenshot": null,
  "context": null,
  "skipped_steps": [3],
  "notes": [
    {
      "step": 1,
      "text": "Button is called 'Add destination' now",
      "at": "2026-09-07T10:12:03Z"
    }
  ],
  "secret_treated": [
    {
      "location": "values.api_key",
      "kind": "api_key"
    }
  ],
  "verify": null,
  "deferral_count": 0,
  "resumed_from": null,
  "app_reachable": true,
  "already_delivered": false,
  "runbooks": [],
  "spec_text": null
}
