{
  "outcome_version": 1,
  "handoff_id": "hf_7k3m9p2q4r",
  "status": "not_verified",
  "final": true,
  "instruction": "Recorded as not verified. If you can still verify, call handoff_verify; a late report is accepted.",
  "round": 1,
  "current_step": {
    "index": 4,
    "total": 4,
    "text": "Paste it into .env as STRIPE_WEBHOOK_SECRET."
  },
  "user_text": null,
  "screenshot": null,
  "context": null,
  "skipped_steps": [],
  "notes": [],
  "secret_treated": [],
  "verify": {
    "ok": null,
    "detail": "The staging environment was down, so the test event could not be sent.",
    "reported_at": "2026-09-08T09:02:11Z",
    "late": true
  },
  "deferral_count": 0,
  "resumed_from": null,
  "app_reachable": true,
  "already_delivered": false,
  "runbooks": [],
  "spec_text": null
}
